<!ELEMENT questions (question+)>
<!ELEMENT question (text, answer, choices)>
<!ATTLIST question id CDATA #REQUIRED>
<!ELEMENT text (#PCDATA)>
<!ELEMENT answer (#PCDATA)>
<!ELEMENT choices (choice+)>
<!ELEMENT choice (#PCDATA)>